cluster,intent,keywords_count,total_frequency,top_keyword,regions
структура сайта,mixed,1,37,структура сайта для интернет магазина,Все регионы
агат липецк,mixed,1,36,агат липецк мебель для школы официальный сайт,Все регионы
продающие сайты,mixed,1,36,продающие сайты для бизнеса,Все регионы
сайт игр,mixed,1,36,сайт игр для компании онлайн,Все регионы
компании сайты,mixed,1,35,компании и сайты для google,Все регионы
сайт книг,mixed,1,35,сайт книг для школы,Все регионы
сайты бронированных,mixed,1,35,сайты для бронированных отелей,Все регионы
слова сайта,mixed,1,35,слова для сайта детского сада,Все регионы
услуги картинки,commercial,1,35,услуги картинки для сайта,Все регионы
втб банк,mixed,1,34,втб банк официальный сайт для бизнеса,Все регионы
код интернет,mixed,1,34,код интернет магазина для сайта,Все регионы
сайт аналитики,mixed,1,34,сайт для аналитики бизнеса,Все регионы
школа глухих,mixed,1,34,школа для глухих официальный сайт,Все регионы
айко ресторанов,mixed,2,34,айко для ресторанов сайт,Все регионы
компания старт,mixed,1,33,компания старт оборудование для автосервиса официальный сайт,Все регионы
мегафон сайт,mixed,1,33,мегафон сайт для бизнеса,Все регионы
производства сайта,mixed,1,33,производства сайта для интернет магазина,Все регионы
сайт интимных,mixed,1,33,сайт для интимных услуг,Все регионы
сайты программирования,mixed,1,33,сайты для программирования в школах,Все регионы
салют бизнеса,mixed,1,33,салют для бизнеса сайт,Все регионы
информация юриста,mixed,1,32,информация для юриста для сайта,Все регионы
сбербанк россии,mixed,1,32,сбербанк россии для малого бизнеса официальный сайт,Все регионы
ozon доставка,mixed,1,32,ozon доставка для сайта,Все регионы
доставка картинка,mixed,1,31,доставка картинка для сайта,Все регионы
клен официальный,mixed,1,31,клен официальный сайт оборудование для пищевых производств,Все регионы
онкологические сайты,mixed,1,31,онкологические сайты для врачей,Все регионы
посуда кафе,mixed,1,31,посуда для кафе и ресторанов сайт,Все регионы
турецкий сайт,mixed,1,31,турецкий сайт для бронирования отелей,Все регионы
услуги сайта,commercial,1,31,юр услуги для сайта,Все регионы
speedo интернет,mixed,1,31,speedo интернет магазин для плавания официальный сайт,Все регионы
сайт заказа,mixed,2,31,сайт для заказа отеля,Все регионы
бизнес чат,mixed,1,30,бизнес чат для сайта,Все регионы
инвесторы бизнеса,mixed,1,30,инвесторы для бизнеса сайт,Все регионы
картинки сайтов,mixed,1,30,картинки для сайтов детских садов,Все регионы
продающий сайт,mixed,1,30,продающий сайт для услуг,Все регионы
сайт бухгалтерской,mixed,1,30,сайт для бухгалтерской компании,Все регионы
сайт производственных,mixed,1,30,сайт для производственных компаний,Все регионы
сайты малого,mixed,1,30,сайты для малого и среднего бизнеса,Все регионы
тор моя,mixed,1,30,тор моя школа информация для сайта,Все регионы
чат сайта,mixed,1,30,чат для сайта услуг,Все регионы
создать бесплатный,mixed,2,30,создать бесплатный сайт для детского сада,Все регионы
документы сайта,mixed,1,29,документы для сайта интернет магазина,Все регионы
макс бизнеса,mixed,1,29,макс для бизнеса сайт,Все регионы
сайт собственного,mixed,1,29,сайт для собственного бизнеса,Все регионы
сайт эскорт,mixed,1,29,сайт для эскорт услуг,Все регионы
шеф сайт,mixed,1,29,шеф оф сайт оборудование для ресторанов,Все регионы
какой конструктор,mixed,1,28,какой конструктор сайта для интернет магазина,Все регионы
лореаль официальный,mixed,1,28,лореаль официальный сайт для врачей,Все регионы
сайт открытия,mixed,1,28,сайт для открытия бизнеса,Все регионы
сайт еды,mixed,1,28,сайт еды для ресторанов,Все регионы
сайт сбер,mixed,1,28,сайт сбер для малого бизнеса,Все регионы
сайты аналитики,mixed,1,28,сайты для аналитики компаний,Все регионы
сайты детей,mixed,1,28,сайты для детей начальной школы,Все регионы
требования сайту,mixed,1,28,требования к сайту ит компании для аккредитации,Все регионы
фон компании,mixed,1,28,фон для компании сайт,Все регионы
хостинги сайтов,mixed,1,28,хостинги сайтов для компаний,Все регионы
сайты оказания,mixed,2,28,сайты для оказания юридических услуг,Все регионы
государственные сайты,mixed,1,27,государственные сайты для бизнеса,Все регионы
забронируй сайт,mixed,1,27,забронируй сайт для отелей,Все регионы
медлок программа,mixed,1,27,медлок программа для стоматологии медицинская официальный сайт,Все регионы
сайт ведения,mixed,1,27,сайт для ведения бизнеса,Все регионы
сайт минздрава,mixed,1,27,сайт минздрава для врачей,Все регионы
сайт псб,mixed,1,27,сайт псб для бизнеса,Все регионы
сайты детского,mixed,1,27,сайты для детского сада музыкальные,Все регионы
фотографии сайта,mixed,1,27,фотографии для сайта компании,Все регионы
сайт оценок,mixed,1,26,сайт для оценок в школе,Все регионы
сайт подачи,mixed,1,26,сайт для подачи документов в школу,Все регионы
сайт работников,mixed,1,26,сайт для работников детского сада,Все регионы
сайт презентаций,mixed,1,26,сайт презентаций для школы,Все регионы
сайты промышленных,mixed,1,26,сайты для промышленных компаний,Все регионы
сайты доказательной,mixed,1,26,сайты доказательной медицины для врачей,Все регионы
школа диабетиков,mixed,1,26,школа для диабетиков 2 типа официальный сайт,Все регионы
сайт знакомств,mixed,2,26,сайт знакомств для врачей,Все регионы
баллы врачей,mixed,1,25,баллы для врачей сайт,Все регионы
бетховен интернет,mixed,1,25,бетховен интернет магазин для животных сайт,Все регионы
бизнес требования,mixed,1,25,бизнес требования для сайта,Все регионы
диамарка официальный,mixed,1,25,диамарка официальный сайт интернет магазин для диабетиков,Все регионы
сайт бухгалтерских,mixed,1,25,сайт для бухгалтерских услуг,Все регионы
сайты новорожденных,mixed,1,25,сайты для новорожденных интернет магазин,Все регионы
статья компании,mixed,1,25,статья о компании для сайта,Все регионы
гришко интернет,mixed,1,24,гришко интернет магазин для танцев официальный сайт,Все регионы
гришко сайт,mixed,1,24,гришко сайт интернет магазин для танцев,Все регионы
деваль официальный,mixed,1,24,деваль официальный сайт интернет магазин для парикмахеров,Все регионы
интернист официальный,mixed,1,24,интернист ру официальный сайт для врачей,Все регионы
сайт предоставления,mixed,1,24,сайт для предоставления своих услуг,Все регионы
сайт статей,mixed,1,24,сайт для статей врачам,Все регионы
цвета сайта,mixed,1,24,цвета для сайта компании,Все регионы
школа слепых,mixed,1,24,школа для слепых и слабовидящих сайт,Все регионы
roche posay,mixed,1,24,la roche posay сайт для врачей,Все регионы
адента программа,mixed,1,23,адента программа для стоматологии официальный сайт,Все регионы
копилка педагога,mixed,1,23,копилка педагога сайт для воспитателей детских садов,Все регионы
речь сайта,mixed,1,23,речь для сайта школы,Все регионы
сайт ветеринарной,mixed,1,23,сайт для ветеринарной клиники,Все регионы
сайт клининговой,mixed,1,23,сайт для клининговой компании,Все регионы
сайт подбора,mixed,1,23,сайт для подбора отелей,Все регионы
сайт частной,mixed,1,23,сайт для частной клиники,Все регионы
сайта интернет,commercial,1,23,сайта для интернет магазина под ключ,Все регионы
сайты знакомств,mixed,1,23,сайты знакомств для бизнеса,Все регионы
фоны сайта,mixed,1,23,фоны для сайта школа,Все регионы
фото бизнес,mixed,1,23,фото для бизнес сайта,Все регионы
вилена мебель,mixed,1,22,вилена мебель для детских садов официальный сайт,Все регионы
внутренний сайт,mixed,1,22,внутренний сайт компании для сотрудников,Все регионы
выдумщики официальный,mixed,1,22,выдумщики официальный сайт интернет магазин для мыловаров,Все регионы
лукойл бизнеса,mixed,1,22,лукойл для бизнеса официальный сайт,Все регионы
мегафон бизнеса,mixed,1,22,мегафон для бизнеса официальный сайт,Все регионы
медицина своих,mixed,1,22,медицина для своих тольятти официальный сайт врачи,Все регионы
модуль доставки,mixed,1,22,модуль доставки для сайта,Все регионы
сайт энергосбытовой,mixed,1,22,сайт для энергосбытовой компании,Все регионы
сайт объявлений,mixed,1,22,сайт объявлений для бизнеса,Все регионы
совкомбанк бизнеса,mixed,1,22,совкомбанк для бизнеса официальный сайт,Все регионы
яндекс банк,mixed,1,22,яндекс банк для бизнеса официальный сайт,Все регионы
атис оборудование,mixed,1,21,атис оборудование для автосервиса официальный сайт,Все регионы
дарз официальный,mixed,1,21,дарз официальный сайт подъемники для автосервиса,Все регионы
купить готовый,commercial,1,21,купить готовый сайт для интернет магазина,Все регионы
макет сайта,mixed,1,21,макет для сайта компании,Все регионы
мсп сайт,mixed,1,21,мсп сайт для бизнеса,Все регионы
про болезни,mixed,1,21,про болезни сайт для врачей,Все регионы
сайт кафе,commercial,1,21,сайт для кафе цена,Все регионы
сайт оптовой,mixed,1,21,сайт для оптовой компании,Все регионы
сайт руководителя,mixed,1,21,сайт для руководителя детского сада,Все регионы
сайты тестов,mixed,1,21,сайты тестов для школы,Все регионы
сбербизнес сайт,mixed,1,21,сбербизнес сайт для малого бизнеса,Все регионы
школа россии,mixed,1,21,школа россии сайт для учителей,Все регионы
заметки сайта,mixed,1,20,заметки для сайта детского сада,Все регионы
мтс сайт,mixed,1,20,мтс сайт для бизнеса,Все регионы
стоимость сайта,commercial,1,20,стоимость сайта для интернет магазина,Все регионы
фото доставки,mixed,1,20,фото доставки для сайта,Все регионы
школа английского,mixed,1,20,школа английского для детей сайт,Все регионы
гарант сайт,mixed,1,19,гарант сайт для юристов,Все регионы
девиз детского,mixed,1,19,девиз детского сада для сайта,Все регионы
мои глаза,mixed,1,19,мои глаза для бизнеса алкон официальный сайт,Все регионы
просвим интернет,mixed,1,19,просвим интернет магазин для плавания официальный сайт,Все регионы
сайт автоматизации,mixed,1,19,сайт для автоматизации бизнеса,Все регионы
сайт любого,mixed,1,19,сайт для любого бизнеса,Все регионы
сайт новогуровской,mixed,1,19,сайт новогуровской школы для обучающихся с овз,Все регионы
сайты стоматологии,mixed,1,19,сайты стоматологии для детей,Все регионы
девиз сайта,mixed,1,18,девиз для сайта воспитателя детского сада,Все регионы
доказательная медицина,mixed,1,18,доказательная медицина официальный сайт для врачей,Все регионы
калькулятор доставки,mixed,1,18,калькулятор доставки для сайта,Все регионы
медзнания официальный,mixed,1,18,медзнания официальный сайт для врачей,Все регионы
подиафарм официальный,mixed,1,18,подиафарм официальный сайт интернет магазин для педикюра,Все регионы
рейтинг сайтов,mixed,1,18,рейтинг сайтов для бронирования отелей,Все регионы
румерс посуда,mixed,1,18,румерс посуда для ресторанов официальный сайт,Все регионы
сайт секс,mixed,1,18,сайт для секс услуг,Все регионы
сайт фармацевтической,mixed,1,18,сайт для фармацевтической компании,Все регионы
сайт дошкольник,mixed,1,18,сайт дошкольник для воспитателей детского сада,Все регионы
сайт образования,mixed,1,18,сайт образования для врачей,Все регионы
сбер сайт,mixed,1,18,сбер сайт онлайн для бизнеса,Все регионы
услуги операторов,commercial,1,18,услуги операторов для сайтов,Все регионы
onetwotrip бизнеса,mixed,1,18,onetwotrip для бизнеса официальный сайт,Все регионы
ками станки,mixed,2,18,ками станки для производства мебели официальный сайт,Все регионы
аэрофлот бизнеса,mixed,1,17,аэрофлот для бизнеса официальный сайт,Все регионы
доставка текст,mixed,1,17,доставка текст для сайта,Все регионы
клен сайт,mixed,1,17,клен сайт посуды для ресторанов,Все регионы
образец сайта,mixed,1,17,образец сайта для школы,Все регионы
псб банк,mixed,1,17,псб банк официальный сайт для бизнеса,Все регионы
публикации сайта,mixed,1,17,публикации для сайта воспитателя детского сада,Все регионы
сайт семашко,mixed,1,17,сайт семашко для записи к врачу,Все регионы
сайт фссп,mixed,1,17,сайт фссп для проверки исполнительных производств,Все регионы
футбольная школа,mixed,1,17,футбольная школа краснодар для детей официальный сайт,Все регионы
школа девочек,mixed,1,17,школа для девочек секса видео сайт,Все регионы
гранд базар,mixed,1,16,гранд базар оборудование для ресторанов официальный сайт,Все регионы
сайт деньги,mixed,1,16,сайт деньги для бизнеса,Все регионы
сайт воскресной,mixed,1,16,сайт для воскресной школы,Все регионы
сайт товаров,mixed,1,16,сайт товаров для рукоделие интернет магазин,Все регионы
сайты музыкального,mixed,1,16,сайты для музыкального руководителя детского сада,Все регионы
самые популярные,mixed,1,16,самые популярные сайты для бронирования отелей,Все регионы
фриланс юриста,mixed,1,16,фриланс для юриста сайты,Все регионы
детство воспитателей,mixed,1,15,детство для воспитателей детских садов сайт,Все регионы
кленмаркет оборудование,mixed,1,15,кленмаркет оборудование для ресторанов официальный сайт,Все регионы
мини сайт,mixed,1,15,мини сайт для воспитателей детского сада,Все регионы
нмо врачей,mixed,1,15,нмо для врачей официальный сайт,Все регионы
оферта сайта,mixed,1,15,оферта для сайта оказание услуг,Все регионы
преимущества сайта,mixed,1,15,преимущества сайта для бизнеса,Все регионы
рефро оборудование,mixed,1,15,рефро ру оборудование для ресторанов официальный сайт,Все регионы
сайт вакансий,mixed,1,15,сайт вакансий для врачей,Все регионы
сайт благодарности,mixed,1,15,сайт для благодарности врачу,Все регионы
сайт малого,mixed,1,15,сайт для ип малого бизнеса,Все регионы
сайт упаковка,mixed,1,15,сайт упаковка для бизнеса,Все регионы
сайты айти,mixed,1,15,сайты для айти компаний,Все регионы
сайты полезные,mixed,1,15,сайты полезные для бизнеса,Все регионы
сайты социальных,mixed,1,15,сайты социальных сетей для бизнеса,Все регионы
яндекс команда,mixed,1,15,яндекс команда для бизнеса официальный сайт,Все регионы
imkosmetik интернет,mixed,1,15,imkosmetik интернет магазин для ногтей официальный сайт,Все регионы
llms txt,mixed,1,15,llms txt для сайта компании,Все регионы
аккредитация врачей,mixed,1,14,аккредитация для врачей официальный сайт,Все регионы
баннер сайта,mixed,1,14,баннер для сайта школы,Все регионы
время знаний,mixed,1,14,время знаний сайт для воспитателей детских садов,Все регионы
детство гид,mixed,1,14,детство гид сайт для воспитателей детских садов,Все регионы
касса сайта,mixed,1,14,касса для сайта интернет магазина,Все регионы
логистика бизнеса,mixed,1,14,логистика для бизнеса сайт,Все регионы
платформа создания,mixed,1,14,платформа для создания сайта интернет магазина,Все регионы
сайт ритуальных,mixed,1,14,сайт для ритуальных услуг,Все регионы
сайт юристов,mixed,1,14,сайт ии для юристов,Все регионы
сайты туристической,mixed,1,14,сайты для туристической компании,Все регионы
создам сайт,mixed,1,14,создам сайт для вашего бизнеса,Все регионы
аванта мебель,mixed,1,13,аванта мебель для стоматологии официальный сайт,Все регионы
виши сайт,mixed,1,13,виши сайт для врачей,Все регионы
идеальный сайт,mixed,1,13,идеальный сайт для управляющей компании,Все регионы
иконки сайта,mixed,1,13,иконки для сайта школы,Все регионы
какие есть,mixed,1,13,какие есть сайты для бронирования отелей,Все регионы
компания марс,mixed,1,13,компания марс корма для животных официальный сайт,Все регионы
отель друзей,mixed,1,13,отель для друзей санкт петербург официальный сайт,Все регионы
ростелеком сотрудников,mixed,1,13,ростелеком для сотрудников компании сайт,Все регионы
сайт приложения,mixed,1,13,сайт приложения для ресторана,Все регионы
сайт услугами,mixed,1,13,сайт с услугами для игр,Все регионы
