cluster,intent,keywords_count,total_frequency,top_keyword,regions
сайты воспитателей,mixed,1,13,сайты для воспитателей школ,Все регионы
сайты начальных,mixed,1,13,сайты для начальных классов школа россии,Все регионы
сайты покупки,mixed,1,13,сайты для покупки робуксов с моментальной доставкой,Все регионы
сайты швейных,mixed,1,13,сайты для швейных производств,Все регионы
топ сайты,mixed,1,13,топ сайты для бизнеса,Все регионы
аптос официальный,mixed,1,12,аптос официальный сайт для врачей,Все регионы
бизнес правила,mixed,1,12,бизнес правила для сайта,Все регионы
генбанк официальный,mixed,1,12,генбанк официальный сайт интернет банк для бизнеса,Все регионы
врачей сайт,mixed,1,12,для врачей сайт личный кабинет,Все регионы
евросив оборудование,mixed,1,12,евросив оборудование для автосервиса официальный сайт,Все регионы
интерактивная разработка,mixed,1,12,интерактивная разработка сайтов для бизнеса,Все регионы
ода сервис,mixed,1,12,ода сервис официальный сайт оборудование для автосервиса,Все регионы
ревлон волос,mixed,1,12,ревлон для волос интернет магазин официальный сайт,Все регионы
сайт литературой,mixed,1,12,сайт с литературой для школы,Все регионы
сайт товары,mixed,1,12,сайт товары для школы,Все регионы
сайты обмена,mixed,1,12,сайты для обмена услугами,Все регионы
турецкие сайты,mixed,1,12,турецкие сайты для бронирования отелей в турции,Все регионы
школа зенит,geo,1,12,школа зенит для детей спб официальный сайт,Все регионы
создать свой,informational,1,11,как создать свой сайт для продажи услуг,Все регионы
клиника медицина,mixed,1,11,клиника медицина для своих тольятти официальный сайт,Все регионы
компания гейзер,mixed,1,11,компания гейзер фильтры для воды официальный сайт,Все регионы
маленькая школа,mixed,1,11,маленькая школа для маленьких челябинск официальный сайт,Все регионы
офиц сайт,mixed,1,11,офиц сайт сбербанка бизнес онлайн для юридических,Все регионы
памятки родителей,mixed,1,11,памятки для родителей на сайт школы,Все регионы
сайт врача,mixed,1,11,сайт для врача создать,Все регионы
сайт жалоб,mixed,1,11,сайт для жалоб на управляющую компанию,Все регионы
сайт тетрадей,mixed,1,11,сайт тетрадей для школы,Все регионы
сайты онлайн,mixed,1,11,сайты онлайн школ для детей,Все регионы
скайп бизнеса,mixed,1,11,скайп для бизнеса официальный сайт,Все регионы
узи сайт,mixed,1,11,узи сайт для врачей,Все регионы
школа сколково,mixed,1,11,школа в сколково для детей официальный сайт,Все регионы
зачем нужен,mixed,1,10,зачем нужен сайт для бизнеса,Все регионы
клатч программа,mixed,1,10,клатч программа для салонов красоты официальный сайт,Все регионы
клен посуда,mixed,1,10,клен посуда для ресторанов официальный сайт,Все регионы
логотип сайта,mixed,1,10,логотип для сайта школы,Все регионы
лярош косметика,mixed,1,10,лярош косметика официальный сайт для врач,Все регионы
миасс стоматология,mixed,1,10,миасс стоматология для всей семьи официальный сайт,Все регионы
мфти школа,mixed,1,10,мфти школа для школьников официальный сайт,Все регионы
примеры сайтов,informational,1,10,примеры сайтов для ресторана,Все регионы
сайт заданиями,mixed,1,10,сайт с заданиями для начальной школы,Все регионы
сайты просмотра,mixed,1,10,сайты для просмотра отелей,Все регионы
страница воспитателя,mixed,1,10,страница воспитателя детского сада для сайта,Все регионы
ворсма официальный,mixed,1,10,тд ворсма официальный сайт для детских садов,Все регионы
crm автосервиса,commercial,1,10,crm для автосервиса готовые сайты купить,Все регионы
альянс продукты,mixed,1,9,альянс м продукты для ресторанов официальный сайт,Все регионы
биодерма сайт,mixed,1,9,биодерма сайт для врачей,Все регионы
вероятность школе,mixed,1,9,вероятность в школе сайт для учителей,Все регионы
документы получения,mixed,1,9,документы для получения категории врача официальный сайт,Все регионы
изречения воспитателя,mixed,1,9,изречения воспитателя детского сада для сайта,Все регионы
ками сайт,mixed,1,9,ками сайт станки для производства мебели,Все регионы
картинки автосервиса,mixed,1,9,картинки автосервиса для сайта,Все регионы
нордберг официальный,mixed,1,9,нордберг официальный сайт цены оборудование для автосервиса,Все регионы
питерский сайт,mixed,1,9,питерский сайт для врачей,Все регионы
программа сайтов,mixed,1,9,программа для сайтов школ могилевской области,Все регионы
сайт гарант,mixed,1,9,сайт гарант заработок для юристов,Все регионы
сайт закрытой,mixed,1,9,сайт для закрытой школы,Все регионы
сайт кассиров,mixed,1,9,сайт для кассиров кафе готовый сайт,Все регионы
сайт компания,mixed,1,9,сайт для компания необходимость,Все регионы
сайт футбольной,mixed,1,9,сайт для футбольной школы что содержит,Все регионы
станки производства,mixed,1,9,станки для производства мебели сайты,Все регионы
текст компании,informational,1,9,текст о компании для сайта пример,Все регионы
текст школе,mixed,1,9,текст о школе для сайта,Все регионы
темп оборудование,mixed,1,9,темп оборудование для автосервиса официальный сайт,Все регионы
фото сотрудников,mixed,1,9,фото сотрудников для сайта компании,Все регионы
частные школы,mixed,1,9,частные школы для детей сайт,Все регионы
эми официальный,mixed,1,9,эми официальный сайт интернет магазин для ногтей,Все регионы
дмитровские подъемники,mixed,1,8,дмитровские подъемники для автосервиса официальный сайт,Все регионы
доставка оплата,mixed,1,8,доставка и оплата текст для сайта,Все регионы
здоровье электросталь,mixed,1,8,здоровье электросталь сайт для записи к врачам,Все регионы
калькулятор услуг,mixed,1,8,калькулятор услуг для сайта,Все регионы
карусель сайт,mixed,1,8,карусель сайт для детских садов,Все регионы
кафе своих,mixed,1,8,кафе для своих тула официальный сайт,Все регионы
лучший конструктор,mixed,1,8,лучший конструктор сайта для школы,Все регионы
отель вас,mixed,1,8,отель для вас пенза официальный сайт,Все регионы
политика конфиденциальности,mixed,1,8,политика конфиденциальности для сайта интернет магазина,Все регионы
промокод сайта,mixed,1,8,промокод для сайта спроси врача,Все регионы
сайт вызова,mixed,1,8,сайт для вызова врача,Все регионы
сайт психологов,mixed,1,8,сайт для психологов детских садов,Все регионы
сайт лайн,mixed,1,8,сайт лайн программа для производства,Все регионы
сайты ветеринарных,mixed,1,8,сайты для ветеринарных врачей,Все регионы
списки запрещенных,mixed,1,8,списки запрещенных сайтов для школ,Все регионы
услуги копирайтера,commercial,1,8,услуги копирайтера для сайта,Все регионы
школа королевы,mixed,1,8,школа королевы геры для дошкольников официальный сайт,Все регионы
эквинет оборудование,mixed,1,8,эквинет оборудование для автосервиса официальный сайт,Все регионы
istom программа,mixed,1,8,istom программа для стоматологии официальный сайт,Все регионы
seo сайта,mixed,1,8,seo для сайта услуг b2b,Все регионы
заказы самозанятых,mixed,1,7,заказы для самозанятых юристов сайт,Все регионы
имкосметик интернет,mixed,1,7,имкосметик интернет магазин для ногтей официальный сайт,Все регионы
лучшие медицинские,mixed,1,7,лучшие медицинские сайты для врачей,Все регионы
магазин клен,mixed,1,7,магазин клен оборудование для ресторанов официальный сайт,Все регионы
озон интернет,mixed,1,7,озон интернет магазин официальный сайт для компьютера,Все регионы
онлайн касса,mixed,1,7,онлайн касса для сайта интернет магазина,Все регионы
описание детского,mixed,1,7,описание детского сада для сайта образец,Все регионы
пользовательское соглашение,mixed,1,7,пользовательское соглашение для сайта фарм компаний,Все регионы
профрешение оборудование,mixed,1,7,профрешение оборудование для салонов красоты официальный сайт,Все регионы
ресторация мебель,mixed,1,7,ресторация мебель для ресторанов официальный сайт,Все регионы
сайт автозапчастей,commercial,1,7,сайт автозапчастей для иномарок недорого с доставкой,Все регионы
сайт запчастей,geo,1,7,сайт запчастей для автомобилей спб быстрая доставка,Все регионы
сайты выставления,mixed,1,7,сайты для выставления услуг,Все регионы
вступительный текст,mixed,1,6,вступительный текст детского сада для сайта,Все регионы
информация юристе,mixed,1,6,информация о юристе для сайта образец,Все регионы
карусель мебель,mixed,1,6,карусель мебель для детских садов официальный сайт,Все регионы
копилка доу,mixed,1,6,копилка доу сайт для воспитателей детских садов,Все регионы
медицинские сайты,mixed,1,6,медицинские сайты для врачей и пациентов,Все регионы
политика возврата,mixed,1,6,политика возврата для сайта интернет магазина одежды,Все регионы
сайт мэри,mixed,1,6,сайт мэри плойки оборудование для детского сада,Все регионы
стоматология вас,mixed,1,6,стоматология для вас набережные челны официальный сайт,Все регионы
стриж сайт,mixed,1,6,стриж сайт для юристов,Все регионы
open evidence,mixed,1,6,open evidence для врачей сайт,Все регионы
бобры сайты,mixed,1,5,бобры сайты для строительных компаний,Все регионы
верхние лихоборы,mixed,1,5,верхние лихоборы мебель для детского сада сайт,Все регионы
кафе вас,mixed,1,5,кафе для вас ижевск официальный сайт,Все регионы
компания красноярск,mixed,1,5,компания кв красноярск сайт комплектующие для окон,Все регионы
ленави мебель,mixed,1,5,ленави мебель для детских садов официальный сайт,Все регионы
окт макулы,mixed,1,5,окт макулы сайт для врача,Все регионы
педпортал сайт,mixed,1,5,педпортал сайт для воспитателей детских садов,Все регионы
регистрация сайте,mixed,1,5,регистрация на сайте спроси врача для врачей,Все регионы
сайт апрель,mixed,1,5,сайт апрель для воспитателей детских садов,Все регионы
сайт битрикс,mixed,1,5,сайт битрикс используют ли компании для x5клуб,Все регионы
сайт мобильное,mixed,1,5,сайт и мобильное приложение для доставки пиццы,Все регионы
сайт мелодинка,mixed,1,5,сайт мелодинка для муз руководителей детского сада,Все регионы
сайт уличным,mixed,1,5,сайт с уличным оборудованием для детского сада,Все регионы
стоимость создания,commercial,1,5,стоимость создания сайта для фитнес клуба,Все регионы
стоматология всей,mixed,1,5,стоматология для всей семьи туапсе официальный сайт,Все регионы
mam сайт,mixed,1,5,mam ru сайт для воспитателей детских садов,Все регионы
