cluster,intent,keywords_count,total_frequency,top_keyword,regions
задания школы,mixed,1,110,задания для школы сайт школы,Все регионы
бизнес видео,mixed,1,109,бизнес видео для сайта,Все регионы
сайты регистрации,mixed,1,109,сайты для регистрации компании,Все регионы
авиасейлс официальный,mixed,1,108,авиасейлс официальный сайт для бизнеса,Все регионы
ван трип,mixed,1,108,ван ту трип для бизнеса официальный сайт,Все регионы
сайт продвижения,mixed,2,108,сайт для продвижения компании,Все регионы
гленфилд официальный,mixed,1,107,гленфилд официальный сайт интернет магазин для женщин,Все регионы
комплекс бар,mixed,1,106,комплекс бар посуда для ресторанов официальный сайт,Все регионы
сайт юриста,mixed,2,105,сайт для юриста создать бесплатный,Все регионы
лореаль сайт,mixed,1,104,лореаль сайт для врачей,Все регионы
сайт втб,mixed,1,102,сайт втб для бизнеса,Все регионы
сайт групп,mixed,1,102,сайт для групп компаний,Все регионы
название компании,mixed,1,101,название компании для сайта,Все регионы
сайт школ,mixed,2,101,сайт для школ искусств,Все регионы
конструктор сайта,mixed,4,101,конструктор сайта для детского сада,Все регионы
сбер бизнес,mixed,1,100,сбер бизнес сайт для бизнеса,Все регионы
петербург сайт,mixed,1,99,петербург сайт для интернет магазина,Все регионы
детский сад,mixed,1,97,детский сад описание для сайта,Все регионы
ванн интернет,mixed,1,97,для ванн интернет магазин сайт,Все регионы
школы сайт,mixed,1,97,для школы сайт ру,Все регионы
сайт студента,mixed,1,97,сайт для студента юриста,Все регионы
сайты руководителей,mixed,1,97,сайты для руководителей компаний,Все регионы
сайты программ,mixed,1,97,сайты программ для бизнеса,Все регионы
сайт просмотра,mixed,3,97,сайт для просмотра компанией,Все регионы
сайт медицинской,mixed,1,96,сайт для медицинской клиники,Все регионы
требования сайта,mixed,1,96,требования для сайта школы,Все регионы
сайт альфа,mixed,1,95,сайт для альфа бизнес,Все регионы
бизнес модель,mixed,1,94,бизнес модель для сайта,Все регионы
описание услуги,commercial,1,93,описание услуги для сайта,Все регионы
сайты скидок,mixed,2,93,сайты скидок для интернет магазинов,Все регионы
пост сайта,mixed,1,92,пост для сайта детского сада,Все регионы
сайт детской,mixed,1,92,сайт для детской школы,Все регионы
сайт ногтей,mixed,1,92,сайт для ногтей интернет магазин,Все регионы
сайт дешевых,mixed,1,91,сайт для дешевых отелей,Все регионы
сайт компаний,mixed,1,91,сайт для ит компаний,Все регионы
сайт развития,mixed,1,91,сайт для развития бизнеса,Все регионы
фис фрдо,mixed,1,91,фис фрдо официальный сайт для школ,Все регионы
озон доставка,mixed,2,91,озон доставка для сайта,Все регионы
дерматолоджи официальный,mixed,1,90,дерматолоджи ру официальный сайт для врачей,Все регионы
сайт личного,mixed,1,90,сайт для личного бизнеса,Все регионы
сайты школ,mixed,2,90,сайты для школ платформы,Все регионы
закажите сайт,mixed,1,89,закажите сайт для интернет магазина,Все регионы
разработка веб,mixed,2,89,разработка веб сайтов для бизнеса,Все регионы
создание сайтов,mixed,3,88,создание сайтов для автосервиса,Все регионы
сайт система,mixed,1,87,сайт и система управления для управляющих компаний,Все регионы
сайт метро,mixed,1,87,сайт метро для бизнеса,Все регионы
сайт платья,mixed,1,87,сайт платья интернет магазин для женщин,Все регионы
математика школы,mixed,1,86,математика для школы сайт,Все регионы
тип сайта,mixed,1,86,тип сайта для компании,Все регионы
сайт косметики,mixed,2,86,сайт косметики интернет магазин для,Все регионы
карта доставки,mixed,1,85,карта доставки для сайта,Все регионы
кафе ресторана,mixed,1,84,кафе для ресторана сайт,Все регионы
рекламные компании,mixed,1,84,рекламные компании для сайта,Все регионы
врачи сайт,mixed,1,83,врачи рф сайт для врачей,Все регионы
сайты пищевых,mixed,1,82,сайты для пищевых производств,Все регионы
интернет магазинов,mixed,1,81,для интернет магазинов оплаты сайты,Все регионы
лучшие конструкторы,mixed,1,81,лучшие конструкторы сайтов для интернет магазинов,Все регионы
сайты оценки,mixed,1,81,сайты для оценки компании,Все регионы
про школу,mixed,2,81,про школу сайт для учителей,Все регионы
покупка сайта,mixed,1,80,покупка сайта для интернет магазина,Все регионы
картинки сайта,mixed,1,79,картинки для сайта бизнеса,Все регионы
сайты консультации,mixed,1,79,сайты для консультации врачей,Все регионы
полезные сайты,mixed,3,79,полезные сайты для школы,Все регионы
популярные сайты,mixed,3,79,популярные сайты для бронирования отелей,Все регионы
медицина сайты,mixed,1,78,медицина сайты для врачей,Все регионы
картинка сайта,mixed,1,77,картинка для сайта школы,Все регионы
сайт выполнения,mixed,1,77,сайт для выполнения услуг,Все регионы
услуги хостинга,commercial,1,77,услуги хостинга для сайта,Все регионы
дополнительные услуги,commercial,1,76,дополнительные услуги для сайта,Все регионы
сайт покупки,mixed,3,76,сайт для покупки бизнеса,Все регионы
лидер детского,mixed,1,75,лидер для детского сада официальный сайт,Все регионы
мэдисон оборудование,mixed,1,75,мэдисон оборудование для салонов красоты официальный сайт,Все регионы
сайт официальных,mixed,1,75,сайт 5 официальных для школы,Все регионы
сайт лидер,mixed,1,75,сайт лидер мебель для детского сада,Все регионы
сайты коррекционных,mixed,1,75,сайты для коррекционных школ,Все регионы
информация родителей,mixed,1,74,информация для родителей сайт школы,Все регионы
сайт фитнес,mixed,1,74,сайт для фитнес клуба,Все регионы
сделать школу,mixed,1,73,сделать школу для сайта,Все регионы
функции сайта,mixed,1,73,функции сайта для компании,Все регионы
карта сайта,mixed,1,72,карта сайта для интернет магазина,Все регионы
сайт директора,mixed,1,71,сайт для директора школы,Все регионы
китайский сайт,mixed,2,71,китайский сайт для доставки,Все регионы
сайт радуга,mixed,1,69,сайт радуга мебель для детских садов,Все регионы
юрист народа,mixed,1,69,юрист для народа сайт,Все регионы
сайт заявок,commercial,1,68,сайт для заявок на услуги,Все регионы
тема сайта,mixed,1,68,тема для сайта бизнес,Все регионы
сайт ресторана,commercial,2,68,сайт для ресторана цена,Все регионы
дизайн услуги,commercial,1,67,дизайн услуги для сайта,Все регионы
сайт вопросов,mixed,1,67,сайт для вопросов врачам,Все регионы
сайт зачисления,mixed,1,67,сайт для зачисления в школу,Все регионы
сайт предложения,mixed,1,67,сайт для предложения своих услуг,Все регионы
кафе друзей,mixed,3,67,кафе для друзей сайт,Все регионы
сайт музыкальной,mixed,1,66,сайт для музыкальной школы,Все регионы
сайт отеля,commercial,3,66,сайт для отеля заказать,Все регионы
портал сайта,mixed,1,65,портал для сайта школы,Все регионы
сайт производства,mixed,1,65,сайт для производства мебели,Все регионы
маррусия продукты,mixed,1,64,маррусия продукты для ресторанов официальный сайт,Все регионы
название сайта,mixed,1,64,название для сайта услуг,Все регионы
сайт заказ,mixed,1,64,сайт на заказ для компаний,Все регионы
сайт продаж,mixed,1,64,сайт продаж для производства,Все регионы
сайты отзывов,mixed,1,63,сайты для отзывов о компаниях,Все регионы
школа интернат,mixed,1,63,школа интернат для слабовидящих официальный сайт,Все регионы
онлайн школа,mixed,1,62,онлайн школа умскул официальный сайт для подготовки,Все регионы
сайты интим,mixed,1,62,сайты для интим услуг,Все регионы
втб официальный,mixed,1,60,втб официальный сайт для бизнеса,Все регионы
продвижения сайтов,mixed,1,60,продвижения сайтов для бизнеса,Все регионы
сайт налоговой,mixed,1,60,сайт налоговой для бизнеса,Все регионы
мебель школы,mixed,1,59,мебель для школы официальный сайт,Все регионы
чего нужен,mixed,1,57,для чего нужен сайт компании,Все регионы
норберг оборудование,mixed,1,57,норберг оборудование для автосервиса официальный сайт,Все регионы
госвеб сайт,mixed,1,56,госвеб сайт для школы,Все регионы
сайт взрослых,mixed,1,56,сайт для взрослых школа,Все регионы
сайт детей,mixed,1,56,сайт для детей интернет магазин,Все регионы
сайты необходимые,mixed,1,56,сайты необходимые для школы,Все регионы
условия доставки,mixed,1,56,условия доставки для сайта,Все регионы
бронирование отелей,mixed,1,55,бронирование отелей за границей для россиян сайты,Все регионы
сайт спортивной,mixed,1,55,сайт для спортивной школы,Все регионы
сайт меню,mixed,2,55,сайт для меню ресторана,Все регионы
парикмахеров официальный,mixed,1,54,для парикмахеров официальный сайт интернет магазин,Все регионы
наличие сайта,mixed,1,54,наличие сайта для компании,Все регионы
разработка создания,mixed,1,54,разработка создания сайтов для бизнеса,Все регионы
регистрация сайта,mixed,1,54,регистрация для сайта школы,Все регионы
сайт организации,mixed,1,54,сайт для организации бизнеса,Все регионы
сайт корм,mixed,1,54,сайт корм для кошек интернет магазин,Все регионы
все отеля,mixed,1,53,все для отеля официальный сайт,Все регионы
корзина сайта,mixed,1,53,корзина для сайта интернет магазина,Все регионы
посты сайта,mixed,1,53,посты для сайта школы,Все регионы
озон банк,mixed,2,53,озон банк для бизнеса сайт,Все регионы
все школ,mixed,1,51,все для школ официальный сайт,Все регионы
сайт главных,mixed,1,51,сайт для главных врачей,Все регионы
сайты подачи,mixed,1,51,сайты для подачи услуг,Все регионы
услуги фото,commercial,1,51,услуги фото для сайта,Все регионы
доставка описание,mixed,1,50,доставка описание для сайта,Все регионы
одностраничный сайт,mixed,1,49,одностраничный сайт для услуг,Все регионы
описание школы,mixed,1,49,описание школы для сайта,Все регионы
сайт почты,mixed,1,49,сайт почты для доставки,Все регионы
сайты школа,mixed,1,49,сайты школа для глухих,Все регионы
сайт детских,mixed,2,49,сайт детских песен для детского сада,Все регионы
бизнес идеи,mixed,1,48,бизнес идеи для сайта,Все регионы
видео сайта,mixed,1,48,видео для сайта компании,Все регионы
делаем сайты,mixed,1,48,делаем сайты для бизнеса,Все регионы
педагог сайт,mixed,1,48,педагог сайт для воспитателей детских садов,Все регионы
поддержка сайт,mixed,1,48,поддержка сайт для бизнеса,Все регионы
сайт средней,mixed,1,48,сайт для средней школы,Все регионы
блок услуг,mixed,1,47,блок услуг для сайта,Все регионы
мед сайты,mixed,1,47,мед сайты для врачей,Все регионы
меню кафе,mixed,1,47,меню кафе для сайта,Все регионы
платформы сайта,mixed,1,47,платформы для сайта интернет магазина,Все регионы
преимущество компании,mixed,1,47,преимущество компании для сайта,Все регионы
русские магниты,mixed,1,47,русские магниты официальный сайт для начальной школы,Все регионы
сайты публикаций,mixed,1,47,сайты для публикаций детский сад,Все регионы
сайты услуг,mixed,1,47,сайты для услуг в москве,Все регионы
фото врачей,mixed,1,47,фото врачей для сайта,Все регионы
виды сайтов,mixed,1,46,виды сайтов для бизнеса,Все регионы
дизайн бизнес,mixed,1,46,дизайн для бизнес сайта,Все регионы
сайты рабочих,mixed,1,46,сайты рабочих программ для школ,Все регионы
услуга размещения,mixed,1,46,услуга для размещения сайта на сервере,Все регионы
сайт помощи,mixed,1,45,сайт для помощи бизнесу,Все регионы
банк официальный,mixed,1,45,т банк официальный сайт для бизнеса,Все регионы
эмс мебель,mixed,1,45,эмс мебель новошахтинск мебель для школы сайт,Все регионы
сайт отслеживания,mixed,2,45,сайт для отслеживания доставки,Все регионы
лдб сайт,mixed,1,44,лдб сайт для врачей,Все регионы
ресторан вас,mixed,1,44,ресторан для вас пенза официальный сайт,Все регионы
росквартал сайт,mixed,1,44,росквартал сайт для управляющих компаний,Все регионы
сайт бизнес,mixed,1,44,сайт для бизнес центра,Все регионы
сайт логистических,mixed,1,44,сайт для логистических компаний,Все регионы
хороший сайт,mixed,1,44,хороший сайт для школы,Все регионы
выгодные сайты,mixed,1,43,выгодные сайты для бронирования отелей,Все регионы
мааам сайт,mixed,1,43,мааам сайт для воспитателей детских садов,Все регионы
модель сайта,mixed,1,43,модель сайта для интернет магазина,Все регионы
раздел доставка,mixed,1,43,раздел доставка для сайта,Все регионы
сайт отзывов,mixed,1,43,сайт для отзывов отелей,Все регионы
сайт очереди,mixed,1,43,сайт для очереди в детский сад,Все регионы
arena магазин,mixed,1,43,arena магазин для плавания официальный сайт интернет,Все регионы
сайт оформления,mixed,2,43,сайт для оформления детского сада,Все регионы
начальная школа,mixed,1,42,начальная школа сайт для учителей начальных классов,Все регионы
озон бизнеса,mixed,1,42,озон для бизнеса сайт,Все регионы
сайт торговой,mixed,1,42,сайт для торговой компании,Все регионы
сайты государственных,mixed,1,42,сайты государственных органов для предоставления услуг,Все регионы
сайты учебников,mixed,1,42,сайты учебников для школы,Все регионы
современный сайт,mixed,1,42,современный сайт для бизнеса,Все регионы
школа милиции,mixed,1,42,школа милиции официальный сайт для девушек,Все регионы
яснополянская школа,mixed,1,42,яснополянская школа для одаренных детей официальный сайт,Все регионы
seo услуги,commercial,1,42,seo услуги для сайтов услуг,Все регионы
школа электрика,mixed,2,42,школа для электрика сайт,Все регионы
сайт хоспонлайн,mixed,2,42,сайт хоспонлайн для записи к врачу,Все регионы
кредит сайт,mixed,1,41,кредит сайт для бизнеса,Все регионы
трип бизнеса,mixed,1,41,он ту трип для бизнеса официальный сайт,Все регионы
программа автодилер,mixed,1,41,программа автодилер для автосервиса официальный сайт,Все регионы
разработка создание,mixed,1,41,разработка и создание сайта для компании,Все регионы
сайты компании,mixed,1,41,сайты для компании друзей,Все регионы
агат мебель,mixed,1,40,агат мебель для школы официальный сайт,Все регионы
история школы,mixed,1,40,история школы для сайта,Все регионы
пример сайта,informational,1,40,пример сайта для школы,Все регионы
расчет доставки,mixed,1,40,расчет доставки для сайтов,Все регионы
сайт стоматологической,mixed,1,40,сайт для стоматологической клиники,Все регионы
сайт сбербанк,mixed,1,40,сайт сбербанк онлайн для малого бизнеса,Все регионы
сайты нмо,mixed,1,40,сайты нмо для врачей,Все регионы
школа сайт,mixed,1,40,школа ру сайт для учителей,Все регионы
сайт сравнения,mixed,2,40,сайт для сравнения цен в интернет магазинах,Все регионы
ает оборудование,mixed,1,39,ает оборудование для автосервиса официальный сайт,Все регионы
правовые сайты,mixed,1,39,правовые сайты для юристов,Все регионы
сбербанк онлайн,mixed,1,39,сбербанк онлайн для бизнеса официальный сайт,Все регионы
педсовет сайт,mixed,1,38,педсовет сайт для воспитателей в детском саду,Все регионы
сайт службы,mixed,1,38,сайт для службы доставки,Все регионы
сайт фриланс,commercial,1,38,сайт для фриланс услуги,Все регионы
сайт стоматология,mixed,1,38,сайт стоматология для всех кострома,Все регионы
страница компании,mixed,1,38,страница о компании для сайта,Все регионы
типы сайтов,mixed,1,38,типы сайтов для бизнеса,Все регионы
профессиональные сайты,mixed,2,38,профессиональные сайты для бизнеса,Все регионы
сайтов рекламы,mixed,1,37,10 сайтов для рекламы услуг клинера,Все регионы
транспортная компания,mixed,1,37,для транспортная компания официальный сайт,Все регионы
интересные сайты,mixed,1,37,интересные сайты для школы,Все регионы
интернет сайт,mixed,1,37,интернет сайт для врачей,Все регионы
история компании,mixed,1,37,история компании для сайта,Все регионы
клиника неврология,mixed,1,37,клиника неврология для всех омск официальный сайт,Все регионы
мгинская школа,mixed,1,37,мгинская школа интернат для слабовидящих детей сайт,Все регионы
рекламные сайты,mixed,1,37,рекламные сайты для бизнеса,Все регионы
