cluster,intent,keywords_count,total_frequency,top_keyword,regions
сайт брони,mixed,2,20277,сайт для брони кубинских отелей,Все регионы
официальный сайт,mixed,18,14759,официальный сайт интернет магазина для,Все регионы
сайт интернет,mixed,16,14740,сайт для интернет магазина,Все регионы
сайт школы,mixed,25,12631,сайт для школы,Все регионы
сайт бизнеса,mixed,14,8132,сайт для бизнеса,Все регионы
сайт компании,mixed,7,7753,сайт для компании,Все регионы
сайт услуг,mixed,10,6718,сайт для услуг,Все регионы
сайт врачей,mixed,9,5175,сайт для врачей,Все регионы
сайты отелей,mixed,1,4021,сайты для отелей,Все регионы
сайт детского,mixed,4,4019,сайт для детского сада,Все регионы
сайты бронирования,mixed,11,2853,сайты для бронирования отелей,Все регионы
сайты доставок,mixed,1,2774,сайты для доставок,Все регионы
сайт записи,mixed,22,2137,сайт для записи к врачу,Все регионы
создать сайт,mixed,30,1898,создать сайт для бизнеса,Все регионы
официальные сайты,mixed,3,1868,официальные сайты для врачей,Все регионы
каталог товаров,mixed,1,1863,каталог товаров для интернет магазина сайта,Все регионы
купить сайт,commercial,8,1693,купить сайт для интернет магазина,Все регионы
сайты производство,mixed,1,1627,сайты для производство,Все регионы
сайт доставки,mixed,18,1627,сайт для доставки еды,Все регионы
валберис интернет,mixed,2,1554,валберис интернет магазин официальный сайт для,Все регионы
сайты ресторанов,mixed,2,1514,сайты для ресторанов,Все регионы
интернет магазин,mixed,18,1514,интернет магазин запчастей для сайта,Все регионы
вайлдберриз интернет,mixed,2,1352,вайлдберриз интернет магазин официальный сайт для,Все регионы
сайты интернет,mixed,9,1254,сайты интернет магазинов для дома,Все регионы
сайты юристов,mixed,4,1239,сайты для юристов,Все регионы
сайт клиники,mixed,3,1166,сайт для клиники,Все регионы
сайт воспитателей,mixed,1,1125,сайт для воспитателей детских садов,Все регионы
оборудование автосервиса,mixed,3,1125,оборудование для автосервиса сайт,Все регионы
бизнес сайты,mixed,2,1030,бизнес сайты для малого бизнеса,Все регионы
сайт сбербанка,mixed,3,1026,сайт сбербанка для бизнеса,Все регионы
сайты школы,mixed,10,1022,сайты для школы дистанционно,Все регионы
сайт онлайн,mixed,4,997,сайт для онлайн школы,Все регионы
лучшие сайты,mixed,10,996,лучшие сайты для отелей,Все регионы
сайт класса,mixed,1,941,сайт для класса школы,Все регионы
какой сайт,mixed,7,916,какой сайт для услуг,Все регионы
сайт автосервиса,mixed,1,911,сайт для автосервиса,Все регионы
сайт стоматологии,mixed,3,833,сайт для стоматологии,Все регионы
создание сайта,mixed,9,832,создание сайта для бизнеса,Все регионы
информация сайта,mixed,3,806,информация для сайта школы,Все регионы
сайты поиска,mixed,14,768,сайты для поиска компаний,Все регионы
разработка сайта,mixed,14,740,разработка сайта для компании,Все регионы
сайты одежды,mixed,1,666,сайты одежды для интернет магазина,Все регионы
сделать сайт,mixed,12,650,сделать сайт для бизнеса,Все регионы
сайт отелей,mixed,3,644,сайт для отелей россии,Все регионы
конструктор сайтов,mixed,5,627,конструктор сайтов для интернет магазина,Все регионы
сбербанк бизнеса,mixed,2,590,сбербанк для бизнеса официальный сайт,Все регионы
сайт посуды,mixed,1,516,сайт посуды для ресторанов,Все регионы
сайт оказания,mixed,2,513,сайт для оказания услуг,Все регионы
сайты начальной,mixed,2,509,сайты для начальной школы,Все регионы
сайт детский,mixed,3,507,сайт детский сад для детей,Все регионы
сайты оплаты,mixed,2,502,сайты для оплаты услуг,Все регионы
сайты рекламы,mixed,4,499,сайты для рекламы услуг,Все регионы
посуда ресторанов,mixed,1,493,посуда для ресторанов официальный сайт,Все регионы
интернист сайт,mixed,4,491,интернист сайт для врачей,Все регионы
сайтов кафе,mixed,1,490,для сайтов кафе,Все регионы
нужен сайт,mixed,5,490,для нужен сайт школы,Все регионы
сайт поиска,mixed,8,486,сайт для поиска отелей,Все регионы
сайт салона,mixed,1,456,сайт для салона красоты,Все регионы
корпоративный сайт,mixed,3,426,корпоративный сайт для компании,Все регионы
сайт страховой,mixed,1,407,сайт для страховой компании,Все регионы
сайты размещения,mixed,2,404,сайты для размещения услуг,Все регионы
компании создания,mixed,1,403,компании для создания сайтов,Все регионы
веб сайта,mixed,1,395,веб сайта для компании,Все регионы
бесплатный сайт,mixed,2,385,бесплатный сайт для бизнеса,Все регионы
фото сайта,mixed,4,381,фото для сайта интернет магазина,Все регионы
сайт воспитатель,mixed,1,374,сайт воспитатель ру для воспитателей детского сада,Все регионы
лучший сайт,mixed,6,370,лучший сайт для интернет магазина,Все регионы
сайта учителей,mixed,1,365,сайта для учителей школ,Все регионы
сайт начинающих,mixed,1,364,сайт для начинающих бизнес,Все регионы
сайт банка,mixed,1,363,сайт банка бизнес для бизнеса,Все регионы
сайт начала,mixed,1,360,сайт для начала бизнеса,Все регионы
мебель детского,mixed,2,357,мебель для детского сада официальный сайт,Все регионы
мам сайт,mixed,2,350,мам ру сайт для воспитателей детских садов,Все регионы
сайты образования,mixed,1,349,сайты для образования в школе,Все регионы
сайт документы,mixed,1,347,сайт документы для школ,Все регионы
рош позе,mixed,4,347,ля рош позе сайт для врачей,Все регионы
сайт выпускников,mixed,1,345,сайт для выпускников школ,Все регионы
сайт ростелеком,mixed,2,344,сайт ростелеком для бизнеса,Все регионы
яндекс сайт,mixed,1,342,яндекс сайт для бизнеса,Все регионы
сайт юрист,mixed,1,338,сайт юрист для людей,Все регионы
сайт осужденных,mixed,1,333,сайт для осужденных интернет магазин,Все регионы
новость сайта,mixed,3,328,новость для сайта детского сада,Все регионы
калужское интернет,mixed,1,327,калужское интернет магазин для осужденных официальный сайт,Все регионы
медицинский сайт,mixed,4,327,медицинский сайт для врачей,Все регионы
сайты бизнеса,mixed,5,327,сайты для бизнеса онлайн,Все регионы
образовательные сайты,mixed,3,326,образовательные сайты для школы,Все регионы
маам сайт,mixed,2,325,маам сайт для воспитателей детских садов,Все регионы
заказать сайт,commercial,7,325,заказать сайт для доставки,Все регионы
проект сайт,mixed,2,323,проект сайт для бизнеса,Все регионы
рестинтернейшен посуда,mixed,1,318,рестинтернейшен посуда для ресторана официальный сайт,Все регионы
сайт поступления,mixed,1,317,сайт для поступления в школу,Все регионы
сайт игрушки,mixed,1,317,сайт игрушки для детских садов,Все регионы
сайт интернете,mixed,1,313,сайт в интернете для компании,Все регионы
сайт мебель,mixed,1,311,сайт мебель для детских садов,Все регионы
открыть сайт,mixed,2,309,открыть сайт для бизнеса,Все регионы
игрушки детских,mixed,1,307,игрушки для детских садов официальный сайт,Все регионы
сайт стендов,mixed,1,306,сайт стендов для школы,Все регионы
юрист людей,mixed,4,305,юрист для людей официальный сайт,Все регионы
продажа сайтов,mixed,1,304,продажа сайтов для интернет магазинов,Все регионы
сайт оборудование,mixed,3,303,сайт оборудование для ресторана,Все регионы
бесплатные сайты,mixed,2,302,бесплатные сайты для услуг,Все регионы
клен оборудование,mixed,2,298,клен оборудование для ресторана сайт,Все регионы
разработка сайтов,mixed,3,296,разработка сайтов для бизнеса,Все регионы
рош сайт,mixed,1,295,ля рош сайт для врачей,Все регионы
школа родителей,mixed,1,295,школа для родителей сайт,Все регионы
заказ сайта,mixed,1,289,заказ сайта для интернет магазина,Все регионы
бесплатный интернет,mixed,1,287,бесплатный интернет магазин для сайта,Все регионы
открыт сайт,mixed,1,287,открыт сайт для бизнеса,Все регионы
создадим сайт,mixed,1,287,создадим сайт для компаний,Все регионы
стенды школы,mixed,1,285,стенды для школы официальный сайт,Все регионы
калипсо стенды,mixed,1,277,калипсо стенды для школы официальный сайт,Все регионы
анализ сайтов,mixed,1,274,анализ сайтов для бизнеса,Все регионы
готовый сайт,mixed,7,274,готовый сайт для интернет магазина,Все регионы
сайт управляющей,mixed,1,273,сайт для управляющей компании,Все регионы
нордберг оборудование,mixed,2,273,нордберг оборудование для автосервиса официальный сайт,Все регионы
новый сайт,mixed,2,272,новый сайт для бизнеса,Все регионы
веб сайты,mixed,1,271,веб сайты для бизнеса,Все регионы
сайт сотрудников,mixed,1,266,сайт для сотрудников компании,Все регионы
банк бизнес,mixed,1,265,банк бизнес для бизнеса официальный сайт,Все регионы
интернет магазины,mixed,1,261,интернет магазины сайты для волос,Все регионы
сайт школа,mixed,3,261,сайт школа для слабовидящих,Все регионы
ростелеком официальный,mixed,3,260,ростелеком официальный сайт для бизнеса,Все регионы
волос официальный,mixed,1,254,для волос официальный сайт интернет магазин,Все регионы
мос услуги,commercial,1,245,мос ру услуги для граждан официальный сайт,Все регионы
сайт юридических,mixed,2,227,сайт для юридических услуг,Все регионы
сайт группы,mixed,2,227,сайт для группы детского сада,Все регионы
темы сайта,mixed,2,224,темы для сайта детского сада,Все регионы
сайты продажи,mixed,3,220,сайты для продажи бизнеса,Все регионы
сайт бронирования,mixed,7,218,сайт для бронирования отелей за границей,Все регионы
сайт приложение,mixed,3,218,сайт приложение для доставки,Все регионы
материалы сайта,mixed,2,216,материалы для сайта школы,Все регионы
спб сайт,geo,2,216,спб сайт для интернет магазина,Все регионы
статьи сайта,mixed,2,211,статьи для сайта детского сада,Все регионы
сайт проверки,mixed,4,209,сайт для проверки компаний,Все регионы
сайт оборудования,mixed,2,209,сайт оборудования для производства,Все регионы
дизайн сайта,mixed,4,208,дизайн сайта для компании,Все регионы
оборудование ресторанов,mixed,1,205,оборудование для ресторанов официальный сайт,Все регионы
информация компании,mixed,1,203,информация о компании для сайта,Все регионы
сайты педагогов,mixed,2,198,сайты для педагогов школ,Все регионы
сайты бизнес,mixed,2,194,сайты для бизнес процессов,Все регионы
стоматология всех,mixed,4,193,стоматология для всех официальный сайт,Все регионы
сайты продвижения,mixed,1,189,сайты для продвижения услуг,Все регионы
роше официальный,mixed,1,188,ля роше официальный сайт для врачей,Все регионы
подготовка школы,mixed,1,187,подготовка для школы сайты,Все регионы
сайт строительных,mixed,1,186,сайт для строительных компаний,Все регионы
товары дома,mixed,1,186,товары для дома интернет магазины сайты,Все регионы
сайт создания,mixed,3,184,сайт для создания услуг,Все регионы
сайт положения,mixed,1,177,сайт положения для школы,Все регионы
сайты учащихся,mixed,2,177,сайты для учащихся школы,Все регионы
ооо бизнес,mixed,2,175,ооо бизнес для бизнеса сайт,Все регионы
сайты заказа,mixed,1,174,сайты для заказа услуг,Все регионы
сайт размещения,mixed,3,174,сайт для размещения компании,Все регионы
one two,mixed,1,172,one two trip официальный сайт для бизнеса,Все регионы
сайт запчасти,mixed,1,171,сайт запчасти для иномарок интернет магазин,Все регионы
тексты сайта,mixed,1,170,тексты для сайта компании,Все регионы
сайты автозапчастей,mixed,1,165,сайты автозапчастей для иномарок интернет магазин,Все регионы
сайты объявлений,mixed,2,164,сайты для объявлений услуг,Все регионы
сайт коммунальных,mixed,1,163,сайт для коммунальных услуг,Все регионы
сайт оплаты,mixed,3,163,сайт для оплаты коммунальных услуг,Все регионы
солидарность жизни,mixed,2,162,солидарность для жизни страховая компания официальный сайт,Все регионы
логотипы компаний,mixed,1,160,логотипы компаний для сайта,Все регионы
сколько стоит,informational,6,158,сколько стоит сайт для интернет магазина,Все регионы
использование сайтов,mixed,1,155,использование сайтов для компании,Все регионы
охрана труда,mixed,1,153,охрана труда для сайта школы,Все регионы
сайты россии,mixed,1,153,сайты россии для бизнеса,Все регионы
доставка еды,mixed,1,152,доставка еды для фуршетов официальный сайт,Все регионы
костис доставка,mixed,1,152,костис доставка еды для фуршетов официальный сайт,Все регионы
сайты товаров,mixed,1,152,сайты товаров для бизнеса,Все регионы
сайты брони,mixed,2,151,сайты для брони отелей,Все регионы
готовые сайты,mixed,4,150,готовые сайты для бизнеса,Все регионы
доктор работе,mixed,2,148,доктор на работе официальный сайт для врачей,Все регионы
сайт сундучок,mixed,1,145,сайт сундучок для воспитателей детских садов,Все регионы
сайт услуги,commercial,1,145,сайт услуги для бизнеса,Все регионы
сайт охрана,mixed,1,144,сайт охрана труда положения для школы,Все регионы
описание компании,mixed,1,138,описание компании для сайта,Все регионы
школа одаренных,mixed,2,138,школа для одаренных детей официальный сайт,Все регионы
написать сайт,mixed,2,138,написать сайт для компании,Все регионы
сайт предпринимателей,mixed,1,137,сайт для предпринимателей малого бизнеса,Все регионы
сайт мебели,mixed,2,136,сайт мебели для школ,Все регионы
альфа банк,mixed,2,135,альфа банк сайт для бизнеса,Все регионы
сайт сферы,mixed,1,134,сайт для сферы услуг,Все регионы
сайт электронной,mixed,1,134,сайт для электронной школы,Все регионы
топ сайтов,mixed,4,134,топ сайтов для отелей,Все регионы
сайт финансовых,mixed,1,132,сайт для финансовых услуг,Все регионы
сайты маникюра,mixed,1,132,сайты для маникюра интернет магазин,Все регионы
сайт регистрации,mixed,3,130,сайт для регистрации бизнеса,Все регионы
сайты заказчиков,mixed,1,129,сайты для заказчиков услуг,Все регионы
статья сайта,mixed,2,129,статья для сайта школы,Все регионы
сайт агентства,mixed,1,128,сайт для агентства недвижимости,Все регионы
сайты юридических,mixed,1,128,сайты для юридических компаний,Все регионы
сайт визитка,mixed,3,128,сайт визитка для компании,Все регионы
беккер интернет,mixed,1,127,беккер интернет магазин для садоводов официальный сайт,Все регионы
личный кабинет,mixed,1,127,личный кабинет для сайта услуг,Все регионы
сайт беккер,mixed,1,127,сайт беккер интернет магазин для садоводов,Все регионы
сайт поликлиники,mixed,1,127,сайт поликлиники для записи к врачу,Все регионы
оплата доставка,mixed,1,126,оплата и доставка для сайта,Все регионы
сайт вашего,mixed,1,126,сайт для вашего бизнеса,Все регионы
сайты исполнителей,mixed,1,124,сайты для исполнителей услуг,Все регионы
сайт транспортной,mixed,1,123,сайт для транспортной компании,Все регионы
сайты учителей,mixed,1,123,сайты для учителей начальной школы,Все регионы
ученик сайт,mixed,1,123,ученик сайт для школы,Все регионы
сайт аккредитации,mixed,2,123,сайт для аккредитации врачей,Все регионы
сайт выбора,mixed,2,123,сайт для выбора бизнеса,Все регионы
сайты владельцев,mixed,1,121,сайты для владельцев бизнеса,Все регионы
новости сайта,mixed,2,121,новости для сайта компании,Все регионы
техносоюз оборудование,mixed,2,120,техносоюз оборудование для автосервиса сайт,Все регионы
яндекс сайта,mixed,1,119,яндекс для сайта интернет магазин,Все регионы
собак интернет,mixed,1,117,для собак интернет магазин официальный сайт,Все регионы
яндекс доставка,mixed,1,117,яндекс доставка для сайта,Все регионы
сайты анализа,mixed,1,116,сайты для анализа компаний,Все регионы
кафе официальный,mixed,1,115,для кафе официальный сайт,Все регионы
сайт ламода,mixed,2,115,сайт ламода интернет магазин для женщин,Все регионы
мебель бизнеса,mixed,3,115,мебель для бизнеса сайт,Все регионы
официальный медицинский,mixed,1,114,официальный медицинский сайт для врачей,Все регионы
юридические сайты,mixed,1,114,юридические сайты для юристов,Все регионы
решения бизнеса,mixed,1,113,решения для бизнеса сайты,Все регионы
сайты врачей,mixed,2,112,сайты для врачей терапевтов,Все регионы
мобильный сайт,mixed,1,111,мобильный сайт для бизнеса,Все регионы
